{
  "schemaVersion": "1.0",
  "runId": "longmemeval-qwen35-9b-q4km-131k-v1-akm-memory-lead",
  "pack": "longmemeval",
  "variant": "akm-memory-lead",
  "memoryBackend": "akm",
  "status": "passed",
  "startedAt": "2026-09-22T00:33:38.996Z",
  "finishedAt": "2026-09-22T01:44:22.396Z",
  "durationMs": 4243400,
  "warnings": [],
  "notes": [
    "LongMemEval executed 500 question(s) and scored them with the official evaluator command.",
    "Overall accuracy: 35.4%",
    "Evaluator model: gpt-4o",
    "Per-question answer checkpoint: /home/founder3/code/github/itlackey/akm-eval/runs/qwen-reference-akm-0.9.16-alpha.2-2026-09-21/akm-memory-lead/.checkpoints/longmemeval-552ece4d1dab3cf1e5e2584b446ead152abe01c0135d11335c80bcc7159b65ae.jsonl (0/500 answer(s) resumed).",
    "Memory-backed retrieval mode using topK=5; each question resets the backend and adds only its own haystack sessions (one document per session) before searching. The full-haystack (`none`/disabled-backend) arm in this same comparison answers every question from its ENTIRE haystack -- a lower score here than that arm does not necessarily mean retrieval quality is worse; it can mean retrieval lost an answer a full-context baseline structurally cannot lose. See metadata.thisArmContextMode.",
    "Retrieval zero-hit rate: 0/500 queries returned no results (0.0%).",
    "Average results returned per query: 4.07 (topK=5). precisionAtK is divided by the number of results actually returned, not by topK, so a backend that returns fewer results per query (e.g. akm returning only genuine hits) reports a structurally higher precisionAtK than a backend that always returns topK results (e.g. raw-vector, with no relevance threshold) for the same underlying retrieval quality. Do not compare precisionAtK across backends with different result-count behavior without accounting for this.",
    "30/500 questions are abstention (\"_abs\") instances, graded on whether the model correctly declines to answer rather than on factual recall. A retrieval arm handed little or no context can abstain more easily than a full-context baseline with more surface to hallucinate from, so part of any overallAccuracy difference between arms on this dataset reflects that confound rather than answer quality alone. See metadata.abstentionQuestionCount.",
    "akm indexing (akm >= 0.9.2): full body prose is indexed, not just synthesized description/tags/heading — the pre-0.9.2 body-prose ceiling was lifted by akm#819 (see docs/memory-backends.md for older runs measured under it). This backend still synthesizes description/tags/heading from the first sentence(s) of each session document and still applies a fixed deterministic stopword strip to each query, but akm search now runs a progressive strict-AND -> prefix-AND -> OR/prefix-OR fallback rather than a hard conjunctive-AND, so a full-AND miss no longer means zero hits. The seeded akm skeleton corpus is stripped before ingestion so no foreign content can appear in results. See src/memory/backends/akm.ts and docs/memory-backends.md."
  ],
  "metrics": {
    "retrieval": {
      "queryCount": 500,
      "precisionAtK": 0.4805,
      "recallAtK": 0.8477,
      "mrr": 0.864267,
      "ndcgAtK": 0.846663
    },
    "context": {
      "queryCount": 500,
      "nonAbstentionQueryCount": 470,
      "literalAnswerContainment": 0.47234,
      "evidenceHitQueryCount": 451,
      "evidenceHitContextAnswerContainment": 0.485588,
      "evidenceHitButAnswerMissingCount": 232
    },
    "answer": {
      "exactMatch": null,
      "tokenF1": null,
      "containsExpected": null,
      "judgedPass": 0.354
    },
    "aggregate": {
      "score": 0.354,
      "retrievalWeight": 0,
      "answerWeight": 1
    }
  },
  "telemetry": {
    "promptTokens": 1728013,
    "completionTokens": 3160,
    "totalTokens": 1731173,
    "estimatedCostUsd": 0,
    "latencyMs": 1348944,
    "logs": [
      "pack=longmemeval",
      "variant=akm-memory-lead",
      "memory=akm",
      "questions=500",
      "evaluatorModel=gpt-4o"
    ],
    "resolvedModels": {
      "qwen3.5-9b": 500
    }
  },
  "artifacts": {
    "resultPath": "/home/founder3/code/github/itlackey/akm-eval/runs/qwen-reference-akm-0.9.16-alpha.2-2026-09-21/akm-memory-lead/result.json",
    "summaryPath": "/home/founder3/code/github/itlackey/akm-eval/runs/qwen-reference-akm-0.9.16-alpha.2-2026-09-21/akm-memory-lead/summary.md",
    "rawOutputPath": "/home/founder3/code/github/itlackey/akm-eval/runs/qwen-reference-akm-0.9.16-alpha.2-2026-09-21/akm-memory-lead/raw-output.json"
  },
  "metadata": {
    "packId": "longmemeval-qwen35-9b-q4km-131k-v1",
    "adapter": "longmemeval",
    "configRunId": "longmemeval-qwen35-9b-q4km-131k-v1",
    "repoCommit": "c0086dfe98ded004e2590ef0833aeb5db79e9d29",
    "runnerType": "openai-compatible",
    "model": "qwen3.5-9b",
    "backendId": "akm",
    "backendKind": "external",
    "backendVersion": "0.9.16-alpha.2",
    "backendDetail": "akm CLI 0.9.16-alpha.2 reachable via [\"akm\"]; `akm info --format json` responded successfully.",
    "benchmarkId": "dataset",
    "datasetSha256": "d6f21ea9d60a0d56f34a05b609c79c88a451d2ae03597821ea3d5a9678c3a442",
    "questionIdsSha256": "a4849b8afda6b6ed31ead4fc28d00784d2d5fef945be87642f5ce3ab710b21c4",
    "promptContract": "longmemeval-v2",
    "promptProtocolSha256": "8ba824b9dc651ad28a9bd1a37209d954d5a96b36dceacfdc03ef3d39ab56a240",
    "evaluatorCodeSha256": "3f1ec16a0696df0b7b5ad52ce1a79908f21236e309d151bc5d1c704cb12ab6c0",
    "judgeScriptSha256": "5822a286ca6406b1c16567b6c281179a7594fdb8a2b88c2de214515ca5c0986a",
    "judgeMaxTokens": 64,
    "judgeMaxUnparseableRate": 0.02,
    "judgeRuntimeFingerprint": null,
    "answerModelArtifactSha256": "cd76ec205963b3b33350093e6904d9de16c4e666fd104e1f632d25c7f15f2a13",
    "answerModelRuntimeImage": "ghcr.io/ggml-org/llama.cpp@sha256:0e537b170ac50a945dcaf258ba9b157c911abf0c9df18d8f2f9fd9d08bec0b2c (b10920 Intel/SYCL; ctx=32768; parallel=2; repeat-penalty=1.1)",
    "questionCount": 500,
    "overallAccuracy": 0.354,
    "evaluatorCommand": "python3 scripts/longmemeval-evaluator.py",
    "evaluatorModel": "gpt-4o",
    "predictionsPath": "/home/founder3/code/github/itlackey/akm-eval/runs/qwen-reference-akm-0.9.16-alpha.2-2026-09-21/akm-memory-lead/predictions.jsonl",
    "evaluationLogPath": "/home/founder3/code/github/itlackey/akm-eval/runs/qwen-reference-akm-0.9.16-alpha.2-2026-09-21/akm-memory-lead/predictions.jsonl.eval-results-gpt-4o",
    "topK": 5,
    "agentRetryCount": 0,
    "checkpointPath": "/home/founder3/code/github/itlackey/akm-eval/runs/qwen-reference-akm-0.9.16-alpha.2-2026-09-21/akm-memory-lead/.checkpoints/longmemeval-552ece4d1dab3cf1e5e2584b446ead152abe01c0135d11335c80bcc7159b65ae.jsonl",
    "checkpointSignature": "552ece4d1dab3cf1e5e2584b446ead152abe01c0135d11335c80bcc7159b65ae",
    "checkpointResumeEnabled": true,
    "resumedQuestionCount": 0,
    "agentResolvedModelCount": 1,
    "agentResolvedModels": "qwen3.5-9b=500",
    "judgeResolvedModelCount": 1,
    "judgeResolvedModels": "gpt-4o-2024-08-06=500",
    "contextSufficiencyDefinition": "normalized-literal-answer-containment; evidence-hit rate conditions on a retrieved ground-truth session; abstention questions excluded",
    "baselineIsLongContext": false,
    "thisArmContextMode": "retrieved-only",
    "abstentionQuestionCount": 30,
    "retrievalQueryCount": 500,
    "zeroHitQueries": 0,
    "zeroHitQueryRate": 0,
    "avgResultsReturned": 4.068,
    "questionsWithoutEvidenceLabels": 0,
    "questionsWithUnmatchableEvidenceLabels": 0,
    "questionsWithSynthesizedHaystack": 0,
    "retrievalMetricsScoreable": true,
    "retrievalCeilingSynthesisRule": "first-sentence(s)-capped-250-chars+metadata-tags+id-heading",
    "retrievalCeilingQueryTransform": "fixed-deterministic-stopword-strip",
    "retrievalCeilingSemanticSearchMode": "off",
    "retrievalCeilingSeededCorpusStripped": true,
    "akmFragmentContextMode": "lead",
    "akmFragmentContextMaxChars": 3200,
    "akmFragmentContextMaxTokens": null,
    "accuracy_single-session": 0.777778,
    "accuracy_multi-session": 0.142857,
    "accuracy_preference": 0.1,
    "accuracy_temporal": 0.120301,
    "accuracy_knowledge-update": 0.525641
  }
}
