{
  "schemaVersion": "1.0",
  "runId": "terminal-bench-baseline",
  "pack": "terminal-bench",
  "variant": "baseline",
  "memoryBackend": "none",
  "status": "warning",
  "startedAt": "2026-05-06T05:00:50.431Z",
  "finishedAt": "2026-05-06T05:01:40.694918+00:00",
  "durationMs": 50263,
  "warnings": [
    "1 Terminal-Bench trial(s) were unresolved according to the official harness."
  ],
  "notes": [
    "Terminal-Bench evaluated 1 trial(s) through the official `tb run` harness.",
    "Resolved 0/1 trial(s) (0.0%).",
    "Agent: akm-eval-opencode (opencode/gpt-4.1-mini)"
  ],
  "metrics": {
    "retrieval": {
      "queryCount": 1,
      "precisionAtK": 0,
      "recallAtK": 0,
      "mrr": 0,
      "ndcgAtK": 0
    },
    "answer": {
      "exactMatch": 0,
      "tokenF1": 0,
      "containsExpected": 0,
      "judgedPass": 0
    },
    "aggregate": {
      "score": 0,
      "retrievalWeight": 0,
      "answerWeight": 1
    }
  },
  "telemetry": {
    "promptTokens": 0,
    "completionTokens": 0,
    "totalTokens": 0,
    "estimatedCostUsd": 0,
    "latencyMs": 50263,
    "logs": [
      "pack=terminal-bench",
      "variant=baseline",
      "memory=none",
      "tbVersion=",
      "dockerVersion=Docker version 29.4.2, build 055a478",
      "model=opencode/gpt-4.1-mini",
      "dataset=terminal-bench-core",
      "selectedTasks=hello-world"
    ]
  },
  "artifacts": {
    "resultPath": "/home/founder3/code/github/itlackey/akm-eval/runs/reference/terminal-bench/baseline/result.json",
    "summaryPath": "/home/founder3/code/github/itlackey/akm-eval/runs/reference/terminal-bench/baseline/summary.md",
    "rawOutputPath": "/home/founder3/code/github/itlackey/akm-eval/runs/reference/terminal-bench/baseline/raw-output.json"
  },
  "metadata": {
    "packId": "terminal-bench",
    "adapter": "terminal-bench",
    "configRunId": "terminal-bench-smoke",
    "repoCommit": "2f4e8299bee542a379e569f2395a420be7b7df5b",
    "runnerType": "opencode",
    "benchmarkId": "terminal-bench-core",
    "benchmarkVersion": "0.1.1",
    "datasetName": "terminal-bench-core",
    "datasetVersion": "0.1.1",
    "datasetPath": null,
    "model": "opencode/gpt-4.1-mini",
    "harnessCommand": "tb",
    "harnessVersion": "",
    "dockerVersion": "Docker version 29.4.2, build 055a478",
    "pythonCommand": "python3",
    "totalTrials": 1,
    "resolvedTrials": 0,
    "unresolvedTrials": 1,
    "attemptsPerTask": 1
  }
}
